{
  "$schema": "https://json-schema.org/draft/2020-12/schema",
  "$id": "https://nextstat.io/schemas/tools/nextstat_agent_bootstrap_profile_manifest_v1.schema.json",
  "title": "NextStat Agent Bootstrap Profile Manifest v1",
  "type": "object",
  "additionalProperties": false,
  "required": [
    "schema_version",
    "registries",
    "coverage_policy",
    "profiles"
  ],
  "properties": {
    "schema_version": {
      "const": "nextstat.agent_bootstrap_profile_manifest.v1"
    },
    "registries": {
      "$ref": "#/$defs/registries"
    },
    "coverage_policy": {
      "type": "object",
      "additionalProperties": false,
      "required": [
        "required_profile_ids",
        "required_runnable_profile_ids",
        "workspace_output_owner_profile_ids",
        "required_workspace_output_profile_ids"
      ],
      "properties": {
        "required_profile_ids": {
          "type": "array",
          "minItems": 1,
          "uniqueItems": true,
          "items": {
            "type": "string",
            "pattern": "^[a-z0-9_]+$"
          }
        },
        "required_runnable_profile_ids": {
          "type": "array",
          "uniqueItems": true,
          "items": {
            "type": "string",
            "pattern": "^[a-z0-9_]+$"
          }
        },
        "workspace_output_owner_profile_ids": {
          "type": "array",
          "minItems": 1,
          "uniqueItems": true,
          "items": {
            "type": "string",
            "pattern": "^[a-z0-9_]+$"
          }
        },
        "required_workspace_output_profile_ids": {
          "type": "array",
          "uniqueItems": true,
          "items": {
            "type": "string",
            "pattern": "^[a-z0-9_]+$"
          }
        }
      }
    },
    "profiles": {
      "type": "array",
      "minItems": 1,
      "items": {
        "$ref": "#/$defs/profile"
      }
    }
  },
  "$defs": {
    "workspace_output_template_family_registry_entry": {
      "type": "object",
      "additionalProperties": false,
      "required": [
        "renderer"
      ],
      "properties": {
        "renderer": {
          "type": "string",
          "enum": [
            "copilot_instructions",
            "cursor_rule"
          ]
        }
      }
    },
    "runnable_template_family_registry_entry": {
      "type": "object",
      "additionalProperties": false,
      "required": [
        "renderer",
        "allowed_kinds",
        "required_fields"
      ],
      "properties": {
        "renderer": {
          "type": "string",
          "enum": [
            "anthropic_example",
            "mcp_example",
            "provider_example"
          ]
        },
        "allowed_kinds": {
          "type": "array",
          "minItems": 1,
          "uniqueItems": true,
          "items": {
            "type": "string",
            "pattern": "^[a-z0-9_]+$"
          }
        },
        "required_fields": {
          "type": "array",
          "minItems": 1,
          "uniqueItems": true,
          "items": {
            "type": "string",
            "pattern": "^[a-z_]+$"
          }
        }
      }
    },
    "registries": {
      "type": "object",
      "additionalProperties": false,
      "required": [
        "workspace_output_template_families",
        "runnable_template_families"
      ],
      "properties": {
        "workspace_output_template_families": {
          "type": "object",
          "minProperties": 1,
          "propertyNames": {
            "pattern": "^[a-z0-9_]+$"
          },
          "additionalProperties": {
            "$ref": "#/$defs/workspace_output_template_family_registry_entry"
          }
        },
        "runnable_template_families": {
          "type": "object",
          "minProperties": 1,
          "propertyNames": {
            "pattern": "^[a-z0-9_]+$"
          },
          "additionalProperties": {
            "$ref": "#/$defs/runnable_template_family_registry_entry"
          }
        }
      }
    },
    "workspace_output": {
      "type": "object",
      "additionalProperties": false,
      "required": [
        "id",
        "path",
        "template_family",
        "purpose"
      ],
      "properties": {
        "id": {
          "type": "string",
          "pattern": "^[a-z0-9_]+$"
        },
        "path": {
          "type": "string",
          "minLength": 1
        },
        "template_family": {
          "type": "string",
          "pattern": "^[a-z0-9_]+$"
        },
        "purpose": {
          "type": "string",
          "minLength": 1
        }
      }
    },
    "transport_config": {
      "type": "object",
      "additionalProperties": false,
      "required": [
        "instructions",
        "snippets",
        "references"
      ],
      "properties": {
        "instructions": {
          "type": "array",
          "minItems": 1,
          "items": {
            "type": "string",
            "minLength": 1
          }
        },
        "snippets": {
          "type": "object",
          "additionalProperties": false,
          "required": [
            "bootstrap",
            "execution_loop"
          ],
          "properties": {
            "bootstrap": {
              "type": "string",
              "minLength": 1
            },
            "execution_loop": {
              "type": "string",
              "minLength": 1
            }
          }
        },
        "references": {
          "type": "array",
          "minItems": 1,
          "items": {
            "type": "string",
            "minLength": 1
          }
        }
      }
    },
    "runnable_example": {
      "type": "object",
      "additionalProperties": false,
      "required": [
        "kind",
        "template_family",
        "local_purpose",
        "server_purpose",
        "payload_key"
      ],
      "properties": {
        "kind": {
          "type": "string",
          "pattern": "^[a-z0-9_]+$"
        },
        "template_family": {
          "type": "string",
          "pattern": "^[a-z0-9_]+$"
        },
        "local_purpose": {
          "type": "string",
          "minLength": 1
        },
        "server_purpose": {
          "type": "string",
          "minLength": 1
        },
        "payload_key": {
          "type": "string",
          "minLength": 1
        },
        "prompt_key": {
          "type": "string",
          "minLength": 1
        },
        "instruction_key": {
          "type": "string",
          "minLength": 1
        },
        "default_model": {
          "type": "string",
          "minLength": 1
        }
      }
    },
    "profile": {
      "type": "object",
      "additionalProperties": false,
      "required": [
        "id",
        "title",
        "summary",
        "references",
        "instructions",
        "transports"
      ],
      "properties": {
        "id": {
          "type": "string",
          "pattern": "^[a-z0-9_]+$"
        },
        "title": {
          "type": "string",
          "minLength": 1
        },
        "summary": {
          "type": "string",
          "minLength": 1
        },
        "references": {
          "type": "array",
          "minItems": 1,
          "items": {
            "type": "string",
            "minLength": 1
          }
        },
        "instructions": {
          "type": "array",
          "minItems": 1,
          "items": {
            "type": "string",
            "minLength": 1
          }
        },
        "transports": {
          "type": "object",
          "additionalProperties": false,
          "required": [
            "local",
            "server"
          ],
          "properties": {
            "local": {
              "$ref": "#/$defs/transport_config"
            },
            "server": {
              "$ref": "#/$defs/transport_config"
            }
          }
        },
        "runnable_example": {
          "$ref": "#/$defs/runnable_example"
        },
        "workspace_outputs": {
          "type": "array",
          "minItems": 1,
          "items": {
            "$ref": "#/$defs/workspace_output"
          }
        }
      }
    }
  }
}
